<?xml version="1.0" encoding="UTF-8"?>
<deegreeWFS configVersion="0.6.0" xmlns="http://www.deegree.org/services/wfs" xmlns:xsi="http://www.w3.org/2001/XMLSchema-instance"
  xsi:schemaLocation="http://www.deegree.org/services/wfs http://schemas.deegree.org/wfs/0.6.0/wfs_configuration.xsd">
  <SupportedVersions>
    <Version>1.0.0</Version>
    <Version>1.1.0</Version>
  </SupportedVersions>
  <CoordinateFormatter javaClass="org.deegree.geometry.io.DoubleCoordinateFormatter" />
  <EnableTransactions>true</EnableTransactions>
  <DisableResponseBuffering>true</DisableResponseBuffering>
  <QueryCRS>urn:ogc:def:crs:EPSG:6.11.2:4326</QueryCRS>
  <QueryCheckAreaOfUse>true</QueryCheckAreaOfUse>
</deegreeWFS>